Topic,Title,Summary,URL,Revision ID
Entertainment,Cetinje,"Cetinje (Montenegrin: Цетиње, pronounced [t͡sětiɲe]) is a town in Montenegro. It is the former royal capital (prijestonica / приjестоница) of Montenegro and is the location of several national institutions, including the official residence of the president of Montenegro. According to the 2011 census, the town had a population of 14,093 while the Cetinje Municipality had 16,657 residents as of 2011. Cetinje is the centre of Cetinje Municipality. The city rests on a small karst plain surrounded by limestone mountains, including Mount Lovćen, the legendary mountain in Montenegrin historiography. Cetinje was founded in the 15th century and became a cradle of the culture of Montenegro. Its status as the honorary capital of Montenegro is due to its heritage as a long-serving former capital of Montenegro.

",https://en.wikipedia.org/wiki/Cetinje,1173878139
Entertainment,La Mercè,"La Mercè (Catalan pronunciation: [lə məɾˈsɛ]) is the annual festival (Catalan: festa major) of the city of Barcelona in Catalonia, Spain. It has been an official city holiday since 1871, when the local government first organized a program of special activities to observe the Roman Catholic feast day of Our Lady of Mercy, La Mare de Déu de la Mercè in Catalan. Although the actual feast day is September 24, the festivities begin a few days beforehand.
Some of the most important features of the festival were introduced in the year 1902, when parades included papier maché “giants” known as gegants i capgrossos and a popular dance from Empordà that was becoming popular throughout Catalonia: the Sardana. The holiday has enjoyed immense local popularity ever since. 
Among more recently introduced traditions are the annual Catalan Wine Fair, a special correfoc, a 10 km race and the pyro-musical, a display featuring synchronized fireworks, water fountains and music conducted at the base of the Montjuïc mountain.

",https://en.wikipedia.org/wiki/La_Merc%C3%A8,1152520458
Entertainment,Cultural appropriation,"Cultural appropriation is the inappropriate or unacknowledged adoption of an element or elements of one culture or identity by members of another culture or identity. This can be especially controversial when members of a dominant culture appropriate from minority cultures. According to critics of the practice, cultural appropriation differs from acculturation, assimilation, or equal cultural exchange in that this appropriation is a form of colonialism. When cultural elements are copied from a minority culture by members of a dominant culture, and these elements are used outside of their original cultural context – sometimes even against the expressly stated wishes of members of the originating culture – the practice is often received negatively.Cultural appropriation is considered harmful by various groups and individuals, including Indigenous people working for cultural preservation, those who advocate for collective intellectual property rights of the originating, minority cultures, and those who have lived or are living under colonial rule. Cultural appropriation can include exploitation of another culture's religious and cultural traditions, dance steps, fashion, symbols, language, and music.Those who see this appropriation as exploitative state that cultural elements are lost or distorted when they are removed from their originating cultural contexts, and that such displays are disrespectful or even a form of desecration. Cultural elements that may have deep meaning to the original culture may be reduced to ""exotic"" fashion or toys by those from the dominant culture. Kjerstin Johnson has written that, when this is done, the imitator, ""who does not experience that oppression is able to 'play', temporarily, an 'exotic' other, without experiencing any of the daily discriminations faced by other cultures"". The black American academic, musician and journalist Greg Tate argued that appropriation and the ""fetishising"" of cultures, in fact, alienates those whose culture is being appropriated.The concept of cultural appropriation has also been subject to heavy criticism and debate. Critics note that the concept is often misunderstood or misapplied by the general public, and that charges of ""cultural appropriation"" are at times misapplied to situations such as trying food from a different culture or learning about different cultures. Others state that the act of cultural appropriation as it is usually defined does not meaningfully constitute social harm, or the term lacks conceptual coherence. Additionally, the term can set arbitrary limits on intellectual freedom, artists' self-expression, reinforce group divisions, or promote a feeling of enmity or grievance rather than of liberation.",https://en.wikipedia.org/wiki/Cultural_appropriation,1173609140
Entertainment,Cultural anthropology,"Cultural anthropology is a branch of anthropology focused on the study of cultural variation among humans. It is in contrast to social anthropology, which perceives cultural variation as a subset of a posited anthropological constant. The term sociocultural anthropology includes both cultural and social anthropology traditions.
Anthropologists have pointed out that through culture, people can adapt to their environment in non-genetic ways, so people living in different environments will often have different cultures. Much of anthropological theory has originated in an appreciation of and interest in the tension between the local (particular cultures) and the global (a universal human nature, or the web of connections between people in distinct places/circumstances).Cultural anthropology has a rich methodology, including participant observation (often called fieldwork because it requires the anthropologist spending an extended period of time at the research location), interviews, and surveys.",https://en.wikipedia.org/wiki/Cultural_anthropology,1173276559
Entertainment,Cultural influence of Star Trek,"The science fiction multimedia franchise of Star Trek since its original debut in 1966 has been one of the most successful television series in science fiction television history and has been considered by many to have had a large influence in popular culture as a result.The original series, which aired in the late 1960s, has since spawned nine successor series and thirteen movies as of August 2020, merchandise, and a multibillion-dollar industry collectively known as the Star Trek franchise. The franchise is owned by CBS Studios, which currently owns television properties previously held by Paramount Pictures, the studio that produced Star Trek for many decades. Paramount Global continues to hold DVD rights to the television series, and the rights to produce feature films.
Two films, Galaxy Quest (1999) and Free Enterprise (1999), and a television series, The Orville, have been inspired by the cultural influence of Star Trek.

",https://en.wikipedia.org/wiki/Cultural_influence_of_Star_Trek,1176638363
Entertainment,Depiction of Jesus,"The depiction of Jesus in pictorial form dates back to early Christian art and architecture, as aniconism in Christianity was the norm within the ante-Nicene period. It took several centuries to reach a conventional standardized form for his physical appearance, which has subsequently remained largely stable since that time. Most images of Jesus have in common a number of traits which are now almost universally associated with Jesus, although variants are seen.
The conventional image of a fully bearded Jesus with long hair emerged around AD 300, but did not become established until the 6th century in Eastern Christianity, and much later in the West. It has always had the advantage of being easily recognizable, and distinguishing Jesus from other figures shown around him, which the use of a cruciform halo also achieves.  Earlier images were much more varied.
Images of Jesus tend to show ethnic characteristics similar to those of the culture in which the image has been created. Beliefs that certain images are historically authentic, or have acquired an authoritative status from Church tradition, remain powerful among some of the faithful, in Eastern Orthodoxy, Anglicanism, and Roman Catholicism. The Shroud of Turin is now the best-known example, though the Image of Edessa and the Veil of Veronica were better known in medieval times.The representation of Jesus was controversial in the early period; the regional Synod of Elvira in Spain in 306 states in its 36th canon that no images should be in churches. Later, in the Eastern church, Byzantine iconoclasm banned and destroyed images of Christ for a period, before they returned in full strength. In the 16th-century Protestant Reformation, the followers of John Calvin in particular saw images of Christ as idolatrous and enforced their removal. Due to their understanding of the second of the Ten Commandments, most Evangelical Protestants still avoid displaying representations of Jesus in their places of worship.",https://en.wikipedia.org/wiki/Depiction_of_Jesus,1177000308
Entertainment,Black swan emblems and popular culture,"The black swan (Cygnus atratus) is widely referenced in Australian culture, although the character of that importance historically diverges between the prosaic in the east and the symbolic in the west. The black swan is also of spiritual significance in the traditional histories of many Aboriginal Australian peoples across southern Australia. Metaphoric references to black swans have appeared in European culture since long before Europeans became aware of Cygnus atratus in Australia in the 18th century.
The black swan is the official state emblem of Western Australia and is depicted on the flag and coat of arms of Western Australia. The symbol is used in other emblems, coins, logos, mascots and in the naming of sports teams.

",https://en.wikipedia.org/wiki/Black_swan_emblems_and_popular_culture,1173256617
Entertainment,Historic center of Mexico City,"The historic center of Mexico City (Spanish: Centro Histórico de la Ciudad de México), also known as Centro or Centro Histórico, is the central neighborhood in Mexico City, Mexico, focused on Zócalo or main plaza and extending in all directions for a number of blocks, with its farthest extent being west to the Mexico City Alameda Central. The Zocalo is the largest plaza in Latin America. It can hold up to nearly 100,000 people.This section of the capital lies in the municipal borough of Cuauhtémoc, has just over nine square km and occupies 668 blocks. It contains 9,000 buildings, 1,550 of which have been declared of historical importance.  Most of these historic buildings were constructed between the 16th and 20th centuries. It is divided into two zones for preservation purposes. Zone A encompasses the pre-Hispanic city and its expansion from the Viceroy period until Independence. Zone B covers the areas all other constructions to the end of the 19th century that are considered indispensable to the preservation of the area's architectural and cultural heritage.This is where the Spaniards began to build what is now modern Mexico City in the 16th century on the ruins of the conquered Tenochtitlan, capital of the Aztec Empire. As the centre of the ancient Aztec Empire and the seat of power for the Spanish colony of New Spain, the Centro Historico contains most of the city's historic sites from both eras as well as a large number of museums. This has made it a World Heritage Site.

",https://en.wikipedia.org/wiki/Historic_center_of_Mexico_City,1175101569
Entertainment,Cultural property,"Cultural property, also known as cultural patrimony, comprises the physical items that are part of the cultural heritage of a group or society, as opposed to less tangible cultural expressions. They include such items as cultural landscapes, historic buildings, works of art, archaeological sites, as well as collections of libraries, archives and museums.
Cultural property is legally protected by a number of international agreements and national laws. There is intensive cooperation between the United Nations, UNESCO and Blue Shield International on the protection of cultural goods.",https://en.wikipedia.org/wiki/Cultural_property,1157503404
Entertainment,Cultural artifact,"A cultural artifact, or cultural artefact (see American and British English spelling differences), is a term used in the social sciences, particularly anthropology, ethnology and sociology for anything created by humans which gives information about the culture of its creator and users.  Artifact is the spelling in North American English; artefact is usually preferred elsewhere.  
Cultural artifact is a more generic term and should be considered with two words of similar, but narrower, nuance: it can include objects recovered from archaeological sites, i.e. archaeological artifacts, but can also include objects of modern or early-modern society, or social artifacts. For example, in an anthropological context: a 17th-century lathe, a piece of faience, or a television each provides a wealth of information about the time in which they were manufactured and used.
Cultural artifacts, whether ancient or current, have a significance because they offer an insight into: technological processes, economic development and social structure, among other attributes.

",https://en.wikipedia.org/wiki/Cultural_artifact,1152775606
Entertainment,Cultural influence of the September 11 attacks,"The cultural influence of the September 11 attacks (9/11) has been profound and long-lasting. The impact of 9/11 has extended beyond geopolitics into society and culture in general. Immediate responses to 9/11 included greater focus on home life and time spent with family, higher church attendance, and increased expressions of patriotism such as the flying of American flags. The radio industry responded by removing certain songs from playlists, and the attacks have subsequently been used as background, narrative or thematic elements in film, television, music, and literature. 
Already-running television shows, as well as programs developed after 9/11, have reflected post-9/11 cultural concerns.  9/11 conspiracy theories have become social phenomena, despite lack of support from scientists, engineers, and historians. 9/11 has also had a major impact on the religious faith of many individuals; for some it strengthened, to find consolation to cope with the loss of loved ones and overcome their grief; others started to question their faith or lost it entirely, because they could not reconcile it with their view of religion.The culture of the United States succeeding the attacks is noted for heightened security and an increased demand thereof, as well as paranoia and anxiety regarding future terrorist attacks that includes most of the nation. Psychologists have also confirmed that there has been an increased amount of national anxiety in commercial air travel.Due to the significance of the attacks, media coverage was extensive (including disturbing pictures and live video) and prolonged discourse about the attacks in general, resulting in iconography and greater meaning associated with the event. Don DeLillo called it ""the defining event of our time"". The attacks spawned a number of catchphrases, terms, and slogans, many of which continue to be used more than a decade later.
One of the most well-known references and events of the 9/11 attacks is President Bush's response to the situation while visiting students at Emma E. Booker Elementary in Sarasota, Florida. Chief of Staff Andy Card approached Bush and whispered in his ear while the president was addressing the children. Bush requested a moment of silence. He claimed he did not want to 'rattle the kids' and continued on with his visit.",https://en.wikipedia.org/wiki/Cultural_influence_of_the_September_11_attacks,1175162909
Entertainment,Cultural identity,"Cultural identity is a part of a person's identity, or their self-conception and self-perception, and is related to nationality, ethnicity, religion, social class, generation, locality or any kind of social group that has its own distinct culture. In this way, cultural identity is both characteristic of the individual but also of the culturally identical group of members sharing the same cultural identity or upbringing. Cultural identity is a fluid process that is changed by different social, cultural, and historical experiences. Some people undergo more cultural identity changes as opposed to others, those who change less often have a clear cultural identity. This means that they have a dynamic yet stable integration of their culture.There are three pieces that make up a person's cultural identity: cultural knowledge, category label, and social connections. Cultural knowledge refers to a person's connection to their identity through understanding their culture's core characteristics. Category label refers to a person's connection to their identity through indirect membership of said culture. Social connections refers to a person's connection to their identity through their social relationships. Cultural identity is developed through a series of steps. First, a person comes to understand a culture through being immersed in those values, beliefs, and practices. Second, the person then identifies as a member of that culture dependent on their rank within that community. Third, they develop relationships such as immediate family, close friends, coworkers, and neighbors.Culture is a term that is highly complex and often contested with academics recording about 160 variations in meaning. Underpinning the notion of culture is that it is dynamic and changes over time and in different contexts resulting in many people today identifying with one or more cultures and many different
It is a defining feature of a person's identity, contributing to how they see themselves and the groups with which they identify. A person's understanding of their own and other's identities develops from birth and is shaped by the values and attitudes prevalent at home and in the surrounding community.",https://en.wikipedia.org/wiki/Cultural_identity,1175908322
Entertainment,Ragam (festival),"Ragam  is South India’s biggest Cultural fest hosted by National Institute of Technology, Calicut. Ragam blends a series of fine arts, socio-cultural and literary events, along with a variety of workshops, exhibitions and informal events. The fest attracts thousands of visitors to the campus annually and is one of the most popular cultural fests in India.",https://en.wikipedia.org/wiki/Ragam_(festival),1168519874
Entertainment,Cultural heritage,"Cultural heritage is the heritage of tangible and intangible heritage assets of a group or society that is inherited from past generations. Not all heritages of past generations are ""heritage""; rather, heritage is a product of selection by society.Cultural heritage includes tangible culture (such as buildings, monuments, landscapes, archive materials, books, works of art, and artifacts), intangible culture (such as folklore, traditions, language, and knowledge), and natural heritage (including culturally significant landscapes, and biodiversity). The term is often used in connection with issues relating to the protection of indigenous intellectual property.The deliberate act of keeping cultural heritage from the present for the future is known as preservation (American English) or conservation (British English), which cultural and historical ethnic museums and cultural centers promote, though these terms may have more specific or technical meanings in the same contexts in the other dialect. Preserved heritage has become an anchor of the global tourism industry, a major contributor of economic value to local communities.Legal protection of cultural property comprises a number of international agreements and national laws.
United Nations, UNESCO and Blue Shield International deal with the protection of cultural heritage. This also applies to the integration of United Nations peacekeeping.",https://en.wikipedia.org/wiki/Cultural_heritage,1176090343
Entertainment,Música popular brasileira,"Música popular brasileira (Portuguese pronunciation: [ˈmuzikɐ popuˈlaʁ bɾaziˈlejɾɐ], Popular Brazilian Music) or MPB is a trend in post-bossa nova urban popular music in Brazil that revisits typical Brazilian styles such as samba, samba-canção and baião and other Brazilian regional music, combining them with foreign influences, such as jazz and rock.
This movement has produced and is represented by many Brazilian artists, such as Jorge Ben Jor, Marcos Valle, Ivan Lins, Novos Baianos, Belchior and Dominguinhos, whose individual styles generated their own trends within the genre. The term is often also used to describe any kind of music with Brazilian origins and ""voice and guitar style"" that arose in the late 1960s.
Variations within MPB were the short-lived but influential artistic movement known as tropicália, and the music of samba rock.MPB songs are in part characterized by their harmonic complexity and their elaborate lyrics, which call back to a connection between Brazil's popular music and poetry that has been culturally relevant since the 1920s. It also draws from themes from Brazil's folk music as a part of an effort to create a musical style that reflected true Brazilian culture. During the 1970s, these qualities gave the style an intellectual prestige that made it more popular for listening as an art form rather than being used as music for dancing, further distinguishing it from other popular music of the time. However, this was not always the case, as demonstrated by music by artists such as Jorge Ben Jor, many of whose songs fall into the category of dance music.Many of the albums on Rolling Stone Brazil's list of the 100 greatest Brazilian albums fall under the MPB style.",https://en.wikipedia.org/wiki/M%C3%BAsica_popular_brasileira,1175263015
Entertainment,Cultural ecology,"Cultural ecology is the study of human adaptations to social and physical environments. Human adaptation refers to both biological and cultural processes that enable a population to survive and reproduce within a given or changing environment. This may be carried out diachronically (examining entities that existed in different epochs), or synchronically (examining a present system and its components). The central argument is that the natural environment, in small scale or subsistence societies dependent in part upon it, is a major contributor to social organization and other human institutions. In the academic realm, when combined with study of political economy, the study of economies as polities, it becomes political ecology, another academic subfield. It also helps interrogate historical events like the Easter Island Syndrome.

",https://en.wikipedia.org/wiki/Cultural_ecology,1172558153
Entertainment,History,"History (derived from Ancient Greek  ἱστορία (historía) 'inquiry; knowledge acquired by investigation') is the systematic study and documentation of the human past.The period of events before the invention of writing systems is considered prehistory. ""History"" is an umbrella term comprising past events as well as the memory, discovery, collection, organization, presentation, and interpretation of these events. Historians seek knowledge of the past using historical sources such as written documents, oral accounts, art and material artifacts, and ecological markers. History is incomplete and still has debatable mysteries.
History is an academic discipline which uses a narrative to describe, examine, question, and analyze past events, and investigate their patterns of cause and effect. Historians debate which narrative best explains an event, as well as the significance of different causes and effects. Historians debate the nature of history as an end in itself, and its usefulness in giving perspective on the problems of the present.Stories common to a particular culture, but not supported by external sources (such as the tales surrounding King Arthur), are usually classified as cultural heritage or legends. History differs from myth in that it is supported by verifiable evidence. However, ancient cultural influences have helped create variant interpretations of the nature of history, which have evolved over the centuries and continue to change today. The modern study of history is wide-ranging, and includes the study of specific regions and certain topical or thematic elements of historical investigation. History is taught as a part of primary and secondary education, and the academic study of history is a major discipline in universities.
Herodotus, a 5th-century BC Greek historian, is often considered the ""father of history"", as one of the first historians in the Western tradition, though he has been criticized as the ""father of lies"". Along with his contemporary Thucydides, he helped form the foundations for the modern study of past events and societies. Their works continue to be read today, and the gap between the culture-focused Herodotus and the military-focused Thucydides remains a point of contention or approach in modern historical writing. In East Asia, a state chronicle, the Spring and Autumn Annals, was reputed to date from as early as 722 BC, though only 2nd-century BC texts have survived.",https://en.wikipedia.org/wiki/History,1175857705
