Topic,Title,Summary,URL,Revision ID
Entertainment,Black women in the American music industry,"In the United States, the introduction of new styles of music came during the Transatlantic Slave Trade era. The genres of music include, but are not limited to, blues, rock, gospel music, jazz,  bluegrass, and Hip-hop. Black American women in the music industry have made significant contributions over the years.
This legacy starts in the 1870s with the Fisk Jubilee Singers, who performed many different genres of black music including traditional spirituals, blues, classic jazz and rhythm and blues, also commonly referred to as R&B. The Fisk Jubilee Singers became popular throughout the world for singing traditional spirituals during their tours in both the United States and England. Sexist attitudes during the early 20th century made it difficult for African-American women to have a strong presence in mainstream music. Despite this, women were still extremely authoritative in the genres of blues, jazz, and R&B.

",https://en.wikipedia.org/wiki/Black_women_in_the_American_music_industry,1176027992
Entertainment,Music censorship,"Censorship of music refers to the practice of editing of musical works for various reasons, stemming from a wide variety of motivations, including moral, political, or religious reasons. Censorship can range from the complete government-enforced legal prohibition of a musical work, to private, voluntary removal of content when a musical work appears in a certain context.",https://en.wikipedia.org/wiki/Music_censorship,1176105582
Entertainment,Musical ensemble,"A musical ensemble, also known as a music group or musical group, is a group of people who perform instrumental and/or vocal music, with the ensemble typically known by a distinct name. Some music ensembles consist solely of instrumentalists, such as the jazz quartet or the orchestra. Other music ensembles consist solely of singers, such as choirs and doo wop groups. In both popular music and classical music, there are ensembles in which both instrumentalists and singers perform, such as the rock band or the Baroque chamber group for basso continuo (harpsichord and cello) and one or more singers. In classical music, trios or quartets either blend the sounds of musical instrument families (such as piano, strings, and wind instruments) or group together instruments from the same instrument family, such as string ensembles (e.g., string quartet) or wind ensembles (e.g., wind quintet). Some ensembles blend the sounds of a variety of instrument families, such as the orchestra, which uses a string section, brass instruments, woodwinds and percussion instruments, or the concert band, which uses brass, woodwinds and percussion.
In jazz ensembles or combos, the instruments typically include wind instruments (one or more saxophones, trumpets, etc.), one or two chordal ""comping"" instruments (electric guitar, acoustic guitar, piano, or Hammond organ), a bass instrument (bass guitar or double bass), and a drummer or percussionist. Jazz ensembles may be solely instrumental, or they may consist of a group of instruments accompanying one or more singers. In rock and pop ensembles, usually called rock bands or pop bands, there are usually guitars and keyboards (piano, electric piano, Hammond organ, synthesizer, etc.), one or more singers, and a rhythm section made up of a bass guitar and drum kit.
Music ensembles typically have a leader. In jazz bands, rock and pop groups and similar ensembles, this is the band leader. In classical music, orchestras, concert bands and choirs are led by a conductor. In orchestra, the concertmaster (principal first violin player) is the instrumentalist leader of the orchestra. In orchestras, the individual sections also have leaders, typically called the ""principal"" of the section (e.g., the leader of the viola section is called the ""principal viola""). Conductors are also used in jazz big bands and in some very large rock or pop ensembles (e.g., a rock concert that includes a string section, a horn section and a choir which are accompanying a rock band's performance).",https://en.wikipedia.org/wiki/Musical_ensemble,1173255334
Entertainment,Record chart,"A record chart, in the music industry, also called a music chart, is a ranking of recorded music according to certain criteria during a given period. Many different criteria are used in worldwide charts, often in combination. These include record sales, the amount of radio airplay, the number of downloads, and the amount of streaming activity.
Some charts are specific to a particular musical genre and most to a particular geographical location. The most common period covered by a chart is one week with the chart being printed or broadcast at the end of this time. Summary charts for years and decades are then calculated from their component weekly charts. Component charts have become an increasingly important way to measure the commercial success of individual songs.
A common format of radio and television programmes is to run down a music chart.",https://en.wikipedia.org/wiki/Record_chart,1175729904
Entertainment,Music of Japan,"In Japan, music includes a wide array of distinct genres, both traditional and modern. The word for ""music"" in Japanese is 音楽 (ongaku), combining the kanji 音 on (sound) with the kanji 楽 gaku (music, comfort). Japan is the world's largest market for music on physical media and the second-largest overall music market, with a retail value of US$2.7 billion in 2017.",https://en.wikipedia.org/wiki/Music_of_Japan,1174950823
Entertainment,Free music,"Free music or libre music is music that, like free software, can freely be copied, distributed and modified for any purpose. Thus free music is either in the public domain or licensed under a free license by the artist or copyright holder themselves, often as a method of promotion. It does not mean that there should be no fee involved. The word free refers to freedom (as in free software), not to price.The Free Music Philosophy generally encourages creators to free music using whatever language or methods they wish.  A Free Music Public License (FMPL) is available for those who prefer a formal approach.
Some free music is licensed under licenses that are intended for software (like the GPL) or other writings (the GFDL).  But there are also licenses especially for music and other works of art, such as EFF's Open Audio License, LinuxTag's Open Music License, the Free Art license and some of the Creative Commons Licences.",https://en.wikipedia.org/wiki/Free_music,1172488290
Entertainment,Who Are You,"Who Are You is the eighth studio album by the English rock band the Who, released on 21 August 1978 by Polydor Records in the United Kingdom and MCA Records in the United States. Although the album received mixed reviews from critics, it was a commercial success, peaking at number 2 on the US charts and number 6 on the UK charts.Who Are You was the Who's final studio album to feature Keith Moon as their drummer. He died three weeks after it was released. The ironic nature of the text ""Not to Be Taken Away"" that was stencilled on Moon's chair on the album cover was noted by some critics.",https://en.wikipedia.org/wiki/Who_Are_You,1171031937
Entertainment,Mockingbird (Eminem song),"""Mockingbird"" is a song by American rapper Eminem from his fifth studio album Encore (2004). It was released as the fifth single from the album in April 2005. It peaked at number 11 on the Billboard Hot 100, and number four in Denmark. It received a Grammy nomination for Best Rap Solo Performance. ""Mockingbird"" was later included on Eminem's greatest hits compilation album Curtain Call: The Hits (2005).",https://en.wikipedia.org/wiki/Mockingbird_(Eminem_song),1176762080
Entertainment,Music of Greenland,"The music of Greenland is a mixture of two primary strands, Inuit and Danish, mixed with influences from the United States and United Kingdom.
Greenland's musical character has been described as ""definitely a rock country, both musically and literally"" according to Greenlandic drummer Hans Rosenberg.  The Danish Ministry of Foreign Affairs describes all Greenlandic music except the drum dances as influenced by external styles.",https://en.wikipedia.org/wiki/Music_of_Greenland,1136810844
Entertainment,List of gospel musicians,"This incomplete list is specifically for Christian music performers in the gospel music genres who have either been very important to the genre, or have had a considerable amount of exposure, such as in the case of one that has been on a major label. This list includes artists that perform in traditional gospel music genres such as Southern gospel, traditional black gospel, urban contemporary gospel, gospel blues, Christian country music, Celtic gospel and British black gospel as well as artists in the general market who have recorded music in these genres. This list is not designed to include performers in the greater Christian music industry specifically contemporary Christian music performers and its subgenres.
Bands are listed by the first letter in their name (not including the words ""a"", ""an"", or ""the""), and individuals are listed by family name.
Note: Because classifying gospel music can be arbitrary, these groupings are generalized and many artists appear on multiple lists.

",https://en.wikipedia.org/wiki/List_of_gospel_musicians,1176719129
Entertainment,Mirchi Music Awards,"Mirchi Music Awards are presented annually by Radio Mirchi to honour both artistic and technical excellence of professionals in the Hindi language film music industry of India. The awards, given in seventeen different categories, were instituted to award the best of 2008. In 2010, the Southern edition of the awards – Mirchi Music Awards South was launched, to award the best of 2009. through which artists from the four South Indian film industries—Tamil, Telugu, Kannada and Malayalam—are being honoured. In 2012, the Bengali edition of the awards – Mirchi Music Awards Bangla was launched, to award the best of 2011. The 2019 Mirchi Music Awards is co-powered by Smule, the world's largest music social network, and will have the winner of the Smule Mirchi Cover Star perform on stage at the event.

",https://en.wikipedia.org/wiki/Mirchi_Music_Awards,1157221996
Entertainment,Christian metal,"Christian metal, also known as white metal, Jesus metal or heavenly metal, is heavy metal music distinguished by its Christian themed song lyrics and the dedication of the band members to Christianity. Christian metal is typically performed by professed Christians, principally for Christians and is often produced and distributed through various Christian networks.Christian metal bands exist in most of the subgenres of heavy metal music, and the only common link among most Christian metal bands are the lyrics. The Christian themes are often melded with the subjects of the genre the band is rooted in, regularly providing a Christian take on the subject matter. It has been argued that the marginal yet transnational Christian metal subculture provides its core members with an alternative religious expression and Christian identity, and that the music serves the purpose of offering a positive message through lyrical content. This may not necessarily show a direct connection or reference to the Christian faith but often it does.Christian metal emerged in the late 1970s as a means of evangelization to the wider heavy metal music scene and was pioneered by the American Resurrection Band and Barnabas, the Swedish Jerusalem, and Canadian Daniel Band. In the mid to late 1980s, extreme metal genres were popularized by bands such as Vengeance Rising, Deliverance, Believer and Tourniquet. Another Christian metal band that was successful during the 80s was American band Stryper, whose album, To Hell with the Devil, sold over two million copies.In the early 1990s, the Australian death metal band Mortification rose to prominence within its country's underground metal scene. In 1993 the 1st german christian Death Metal band Sacrificium was founded. The band is still active At the turn of the 21st century, the nu metal band P.O.D, with two platinum-selling albums, achieved a mainstream commercial success rivaling that of Stryper. The metalcore groups Underoath (2002-2018), Demon Hunter, As I Lay Dying and Norma Jean (dubbed ""The Holy Alliance"" by Revolver Magazine) also brought some mainstream attention to the movement in the first decade of the 2000s, achieving ranks in the Billboard 200. Between the 2000s and 2020s, the Christian metal band Skillet had two albums receiving Grammy nominations, two albums certified platinum and double platinum, and various singles certified platinum and gold.",https://en.wikipedia.org/wiki/Christian_metal,1176107655
Entertainment,Sean Combs discography,"The discography of American rapper Sean Combs (known professionally under the pseudonyms Puffy, Puff Daddy, P. Diddy or Diddy) consists of five studio albums, two collaborative albums, one remix album and seventy-two singles – including thirty-three as a lead artist and thirty-nine as a featured artist. 
Combs began his career in the music industry working as an intern at New York-based record label Uptown Records. He served as an in-house record producer for the label, serving as executive producer for Mary J. Blige's debut albums What's the 411? (1994) and My Life (1997), and was assigned artists and repertoire duties for R&B act Jodeci. In 1993, he was fired from Uptown Records and launched his own label, Bad Boy Records shortly after. He also took a then-unknown Uptown signee, the Notorious B.I.G., along with him to the newly established label. In August 1994, the Notorious B.I.G. released the song ""Juicy"", produced by Combs and one of the labels first releases; it eventually became one of the most successful and influential songs in hip hop music. 
Following B.I.G.'s success during his lifetime, Combs become widely known as his manager and hype man, justifying Combs himself becoming a lead performer with his January 1997 single ""Can't Nobody Hold Me Down"". Prior, he made his recording debut on Super Cat's 1993 single ""Dolly My Baby"" and Lil' Kim's 1996 single ""No Time"". ""Can't Nobody Hold Me Down"", which also introduced Combs' new protégé Mase, proved to be a commercial and critical success, debuting at number 32 on the Billboard Hot 100 and eventually peaking on the chart for six weeks. 
In March 1997, the Notorious B.I.G. was fatally shot by an unknown assailant, prompting Combs to make his second commercial single a tribute song titled ""I'll Be Missing You"", with guest features from Bad Boy members Faith Evans and R&B act 112. The song became the first ever hip hop song to debut at number 1 on the Hot 100, peaked worldwide charts in 15 countries, won a Grammy Award for Best Rap Performance by a Duo or Group, and remains one of the best selling singles of all time. The song and its parent album of which it preceded, No Way Out in July 1997, remain Combs' most successful records to date.
1997 would also be the year which Combs would be the artist with most weeks at number one on the Hot 100 with 19 weeks, and 26 when including the Combs-produced songs ""Hypnotize"" by B.I.G. and ""Honey"" by Mariah Carey. A year later in 1998, Combs would release the singles ""Victory"" (featuring the Notorious B.I.G. and Busta Rhymes) and ""Come with Me"" (featuring Led Zeppelin guitarist Jimmy Page) for the Godzilla soundtrack, while also cultivating acts on the Bad Boy label and producing material for other artists. Combs would release his second and third studio albums Forever (1999) and The Saga Continues... (2001) to relative success, albeit less than his previous work, and generally mixed reviews. By this point and onward, Combs and Bad Boy Records would receive criticism for being seen as the leading exploiter of the dumbing down and over-commercialization of hip hop, and for using too many guest appearances, as well as the over-reliance on samples and interpolations of older hits. Critics would often praise the production value and catchiness, but become weary of Combs' public figure and character, citing the remarkably materialistic nature of his lyrics and an overall lack of originality; commonly alluding to a style over substance argument.

",https://en.wikipedia.org/wiki/Sean_Combs_discography,1177123173
Entertainment,The Recording Academy,"The Recording Academy (formally the National Academy of Recording Arts and Sciences; abbreviated NARAS) is an American learned academy of musicians, producers, recording engineers, and other musical professionals. It is famous for its Grammy Awards, which recognize achievements in the music industry of songs and music which are popular worldwide. The Recording Academy is a founding partner of the Grammy Museum, a non-profit organization whose stated mission is preserving and educating about music history and significance. The Recording Academy also founded MusiCares, a charity with the stated goal of impacting the health and welfare of the music community. The Recording Academy's advocacy team lobbies for music creators' rights at the local, state, and federal levels.

",https://en.wikipedia.org/wiki/The_Recording_Academy,1172795625
Entertainment,NAMM Show,"The NAMM Show is an annual event in the United States that is organized by the National Association of Music Merchants (NAMM), who describe it as ""the industry’s largest stage, uniting the global music, sound and entertainment technology communities"".

",https://en.wikipedia.org/wiki/NAMM_Show,1177079808
Entertainment,BMG Rights Management,"BMG Rights Management GmbH (also known simply as BMG) is an international music company based in Berlin, Germany. It combines the activities of a music publisher and a record label.BMG was founded in October 2008 after Bertelsmann sold its stake in Sony BMG. From 2009 to 2013, the investment firm KKR held 51% of the company, which became one of the world's largest music publishers during that time. BMG is 100% owned by Bertelsmann and one of the group's eight business divisions. The portfolio includes rights in songs and recordings by artists such as Kylie Minogue, Craig David, Avril Lavigne, the Rolling Stones, Tina Turner, the Cranberries, David Bowie, Roger Waters, Iggy Pop, Quincy Jones, Lenny Kravitz Morrissey, 5 Seconds of Summer, KSI, Eraserheads, Francis Magalona, Yano, Ariel Rivera, Rivermaya, and Peter Frampton.

",https://en.wikipedia.org/wiki/BMG_Rights_Management,1175386799
Entertainment,Scarlett Stevens,"Scarlett Stevens is an Australian singer/drummer from the indie band San Cisco, The Flairz and grunge band Ghetto Crystals. She has performed on recordings by Bob Evans and Illy. She is the daughter of Phil Stevens, co-founder of Jarrah Records and manager of John Butler Trio and The Waifs.

",https://en.wikipedia.org/wiki/Scarlett_Stevens,1048476086
Entertainment,Peter Brown (music manager),"Peter Brown is an American-based English businessman. After Brian Epstein recruited Brown to run the Epstein's music store in Liverpool, he became part of the Beatles' management team. He remained Epstein's and the Beatles' personal assistant until the band's dissolution. He helped found and served as a board member of Apple Corps and assumed Epstein's duties after the manager's death. He went on to establish many companies and resides in New York City.

",https://en.wikipedia.org/wiki/Peter_Brown_(music_manager),1115683905
Entertainment,Music of the Philippines,"The music of the Philippines (Filipino: Musika ng Pilipinas) includes the musical performance arts in the Philippines and the music of Filipinos composed in various local and international genres and styles. Philippine musical compositions are often a mixture of  indigenous styles, and various Asian styles, as well as Spanish/Latin American and (US) American influences through foreign rule from those countries.",https://en.wikipedia.org/wiki/Music_of_the_Philippines,1176817811
Entertainment,Soul music,"Soul music is a popular music genre that originated in the African American community throughout the United States in the late 1950s and early 1960s. It has its roots in African-American gospel music and rhythm and blues. Soul music became popular for dancing and listening, where U.S. record labels such as Motown, Atlantic and Stax were influential during the Civil Rights Movement. Soul also became popular around the world, directly influencing rock music and the music of Africa. It also had a resurgence with artists like Erykah Badu under the genre neo-soul.Catchy rhythms, stressed by handclaps and extemporaneous body moves, are an important feature of soul music. Other characteristics are a call and response between the lead vocalist and the chorus and an especially tense vocal sound. The style also occasionally uses improvisational additions, twirls, and auxiliary sounds. Soul music reflects the African-American identity, and it stresses the importance of an African-American culture. The new-found African-American consciousness led to new styles of music that boasted pride in being black, and being such a creative genre of music, it emerged from the power struggle to increase black Americans' awareness of their African ancestry. Soul music also combines different elements of music which includes gospel music, rhythm and blues and jazz.Soul music dominated the U.S. R&B chart in the 1960s, and many recordings crossed over into the pop charts in the U.S., Britain, and elsewhere. By 1968, the soul music genre had begun to splinter. Some soul artists developed funk music, while other singers and groups developed slicker, more sophisticated, and in some cases more politically conscious varieties. Many soul artists gained popularity due to the domination of soul music in the R&B charts. Among these artists were Ray Charles, James Brown and the soul group the Temptations. By the early 1970s, soul music had been influenced by psychedelic and progressive rock, among other genres, leading to psychedelic and progressive soul. The United States saw the development of neo soul around 1994. There are also several other subgenres and offshoots of soul music.
The key subgenres of soul include the Motown style, a more pop-friendly and rhythmic style; deep soul and southern soul, driving, energetic soul styles combining R&B with southern gospel music sounds; Memphis soul, a shimmering, sultry style; New Orleans soul, which came out of the rhythm and blues style; Chicago soul, a lighter gospel-influenced sound; Philadelphia soul, a lush orchestral sound with doo-wop-inspired vocals; as well as psychedelic soul, a blend of psychedelic rock and soul music.

",https://en.wikipedia.org/wiki/Soul_music,1176763396
Entertainment,Brill Building,"The Brill Building is an office building at 1619 Broadway on 49th Street in the New York City borough of Manhattan, just north of Times Square and further uptown from the historic musical Tin Pan Alley neighborhood. It was built in 1931 as the Alan E. Lefcourt Building, after the son of its builder Abraham E. Lefcourt, and designed by Victor Bark Jr. The building is 11 stories high and has approximately 175,000 square feet (16,300 m2) of rentable area.
The Brill Building is famous for housing music industry offices and studios where some of the most popular American songs were written. It is considered to have been the center of the American music industry that dominated the pop charts in the early 1960s. The ""Brill"" name comes from a haberdasher who operated a store at street level and subsequently bought the building. The Brill Building was purchased by 1619 Broadway Realty LLC in June 2013 and underwent renovation during the 2010s. A CVS Pharmacy opened on the first two floors of the building in 2019.",https://en.wikipedia.org/wiki/Brill_Building,1176307809
Entertainment,The Playlist (TV series),"The Playlist is a docu-drama miniseries created for Netflix. It was inspired by the book Spotify Untold written by Sven Carlsson and Jonas Leijonhufvud. Directed by Per-Olav Sørensen, the series tells a ""fictionalized"" story of the birth of the Swedish music streaming company Spotify, along with its early challenges.The Playlist premiered on Netflix on 13 October 2022.

",https://en.wikipedia.org/wiki/The_Playlist_(TV_series),1175118892
